{
  "event_id": "ce_example_1",
  "order_intent_id": "oi_example_1",
  "event_type": "order_authorized",
  "actor": "https://merchants.example.com/actors/checkout-service",
  "timestamp": "2026-04-11T10:15:00Z",
  "event_hash": "sha256:a1b2c3d4e5f67890abcdef1234567890abcdef1234567890abcdef1234567890",
  "prev_event_hash": "sha256:0000000000000000000000000000000000000000000000000000000000000000",
  "metadata": {
    "order_total": "42.50",
    "currency": "USD"
  }
}
